{"schema_version":2,"report":"doctor","checks":[{"name":"claude-binary","severity":"PASS","detail":"Claude Code executable found"},{"name":"claude-version","severity":"PASS","detail":"Claude Code 2.1.203 is supported"},{"name":"claude-skills","severity":"PASS","detail":"recorded skills match"},{"name":"claude-instructions","severity":"PASS","detail":"recorded instructions match"},{"name":"claude-hooks","severity":"PASS","detail":"recorded hooks match"},{"name":"claude-mcp","severity":"PASS","detail":"recorded user MCP entries match"},{"name":"claude-readiness","severity":"WARN","detail":"runtime usability is unknown; start Claude Code explicitly"}],"summary":{"status":"warnings","passes":6,"warnings":1,"failures":0}}
